question,answer
 کدام ماده ذخیره کنندهٔ اطلاعات وراثتی است؟, دنا
 چگونه دانشمندان به این پاسخ رسیده‌اند؟, از طریق آزمایش‌ها و باکتری‌شناسی توسط گریفیت.
 چه تجربه‌ای توسط گریفیت انجام شد؟, آزمایش‌هایی با دو نوع باکتری بر روی موش‌ها.
 کدام نوع باکتری به نام استرپتوکوکوس نومونیا بیماری آنفلوانزا را تصور می‌کرد؟, نوع با پوشینه (کپسول دار).
 چه هدفی در آزمایش‌های گریفیت وجود داشت؟, تولید واکسن برای آنفلوانزا.
 چه نوع باکتری مورد بررسی قرار گرفت؟, استرپتوکوکوس نومونیا.
 نتایج آزمایش بر روی موش‌ها چه گونه بود؟, نوع با پوشینه، سینه پهلو در موش‌ها ایجاد می‌کند.
 آیا نوع بدون پوشینه از باکتری موجب بیماری در موش‌ها می‌شود؟, نه، بیماری نمی‌افتند.
 چگونه گریفیت اثرات باکتری‌ها را بر روی موش‌ها مشاهده کرد؟, با تزریق باکتری‌های پوشینه دار و بدون پوشینه به موش‌ها.
 نتایج تزریق باکتری‌های پوشینه دار چی بود؟, بروز علائم بیماری و مرگ در موش‌ها.
 چگونه گریفیت اثر حرارت بر باکتری‌ها را بررسی کرد؟, با تزریق باکتری‌های پوشینه دار کشته شده با گرما به موش‌ها.
 نتایج تزریق مخلوط باکتری‌های پوشینه دار کشته شده و زنده چی بود؟, موش‌ها در نتیجه تزریق مخلوط مرگ کردند و باکتری‌های پوشینه دار زنده در موش‌های مرده مشاهده شد.
 چه نتیجه‌ای از آزمایش‌های گریفیت به دست آمد؟, انتقال مادهٔ وراثتی ممکن است، اما ماهیت آن ناشناخته است.
 چه عاملی اصلی در انتقال صفات وراثتی نقش دارد؟, مولکول دنا (DNA).
 چگونه دانشمندان ایوری و همکارانش عامل مؤثر در انتقال صفات را شناسایی کردند؟, از عصاره باکتری‌های پوشینه دار باقی‌مانده پس از تخریب پروتئین‌ها استفاده کردند.
 پس از تخریب پروتئین‌ها چه اتفاقی رخ داد؟, باقی‌مانده محلول به محیط کشت باکتری بدون پوشینه اضافه شد و انتقال صفت اثبات شد.
 چه نتیجه‌ای از این تجربه به دست آمد؟, پروتئین‌ها مادهٔ وراثتی نیستند و مولکول دنا اصلی برای انتقال صفات است.
 چگونه مخلوط به دست آمده در آزمایش دیگر جداگانه شد؟, با قرار دادن مخلوط در گریزانه با سرعت بالا.
 چه نتیجه‌ای از جداسازی لایه‌لایه مخلوط به دست آمد؟, انتقال صفت فقط با لایه حاوی دنا انجام می‌شود.
 نتایج آزمایش‌ها چه تأثیری بر تئوری‌های وراثت داشت؟, تأیید کرد که دنا ماده وراثتی اصلی است.
 چرا برخی دانشمندان نتایج را قبول نکردند؟, به دلیل اعتقاد به نقش ماده‌ی وراثتی در پروتئین‌ها.
 چگونه در آزمایش‌ها، نقش آنزیم‌ها در انتقال صفت بررسی شد؟, با اضافه کردن آنزیم‌های تخریب کننده به قسمت‌های مختلف عصارهٔ باکتری و مشاهده انتقال صفت.
 چه نتایجی از آزمایش با آنزیم‌های تخریب کننده به دست آمد؟, انتقال صفت در تمام ظروف انجام می‌شود، به جز زمانی که آنزیم تخریب کننده دنا وجود داشت.
 نتایج این آزمایش‌ها چه مفهومی را برای دانشمندان ایجاد کرد؟, تأیید می‌کند که دنا بازیگر اصلی در انتقال صفت وراثتی است.
 نوکلئیک اسیدها شامل چه دو نوع اصلی هستند؟, دنا (دئوکسی ریبونوکلئیک اسید) و رنا (ریبونوکلئیک اسید).
 نوکلئوتید چه ساختاری دارد؟, قند پنج کربنه، باز آلی نیتروژن دار، و گروه‌های فسفات.
 چه تفاوتی بین دئوکسی ریبوز و ریبوز وجود دارد؟, دئوکسی ریبوز یک اکسیژن کمتر از ریبوز دارد.
 چه گروه‌هایی می‌تواند در باز آلی نیتروژن دار وجود داشته باشد؟, پورین (آدنین و گوانین) و پیریمیدین (سیتوزین، تیمین یا یوراسیل).
 چه تفاوتی بین تیمین و یوراسیل در دنا و رنا وجود دارد؟, در دنا تیمین وجود دارد، اما در رنا باز یوراسیل به جای تیمین استفاده می‌شود.
 تفاوت میان دئوکسی ریبوز و ریبوز چیست؟, دئوکسی ریبوز یک اکسیژن کمتر از ریبوز دارد.
 چه گروه‌هایی می‌توانند در باز آلی نیتروژن دار وجود داشته باشند؟, پورین (آدنین و گوانین) و پیریمیدین (سیتوزین، تیمین یا یوراسیل).
 تفاوت میان ساختار دو حلقه‌ای و تک حلقه‌ای پورین چیست؟, پورین دو حلقه‌ای (آدنین و گوانین) و تک حلقه‌ای (یوراسیل) است.
 در ساختار دنا چه باز هایی شرکت ندارند؟, دنا باز یوراسیل و باز آلی نیتروژن دار (آدنین و گوانین) شرکت ندارند.
 چه تفاوتی بین تیمین و یوراسیل در رنا وجود دارد؟, در رنا به جای تیمین، باز یوراسیل وجود دارد.
 چه عوامل به تشکیل نوکلئوتید کمک می‌کنند؟, باز آلی نیتروژن دار و گروه یا گروه‌های فسفات با پیوند اشتراکی.
 چگونه نوکلئوتیدها از نظر نوع قند، باز آلی و تعداد گروه‌های فسفات با یکدیگر تفاوت دارند؟, تفاوت‌ها در نوع قند (دئوکسی ریبوز یا ریبوز)، نوع باز آلی نیتروژن دار (پورین یا پیریمیدین) و تعداد گروه‌های فسفات وجود دارد.
 چه نوع پیوندی در نوکلئوتیدها به نام فسفودی استر وجود دارد؟, پیوند اشتراکی فسفودی استر.
 چگونه نوکلئوتیدها به هم متصل می‌شوند؟, نوکلئوتیدها با پیوند فسفودی استر به یکدیگر متصل می‌شوند و رشته پلی نوکلئوتیدی را می‌سازند.
 گروه عاملی فسفو دی استر در ساختار نوکلئوتید چیست؟, گروه عاملی فسفو دی استر با فرمول pOPO و در نوکلئوتیدها به عنوان پیوند فسفودی استر وجود دارد.
 رشته‌های پلی نوکلئوتیدی چه می‌سازند؟, رشته‌های پلی نوکلئوتیدی نوکلئیک اسیدها (مثل دنا) یا رنا را می‌سازند.
 چگونه نوکلئوتیدها به رشته پلی نوکلئوتیدی متصل می‌شوند؟, نوکلئوتیدها با پیوند فسفودی استر به یکدیگر متصل می‌شوند و رشته پلی نوکلئوتیدی را می‌سازند.
 چگونه مولکول‌های دنا تشکیل می‌شوند؟, مولکول‌های دنا از دو رشته پلی نوکلئوتید تشکیل می‌شوند.
 چگونه مولکول‌های رنا تشکیل می‌شوند؟, مولکول‌های رنا از یک رشته پلی نوکلئوتید تشکیل می‌شوند.
 چگونه می‌توان دو انتهای رشته‌های پلی نوکلئوتید را با پیوند فسفودی استر به هم متصل کرد؟, دو انتهای رشته‌های پلی نوکلئوتید می‌توانند با پیوند فسفودی استر به هم متصل شوند و نوکلئیک اسید حلقوی را ایجاد کنند.
 چگونه ساختار نوکلئیک اسید حلقوی در باکتری‌ها است؟, در باکتری‌ها، دنا به صورت حلقوی است.
 در نوکلئیک اسیدهای خطی، چه گروه‌هایی در انتهای‌ها آزاد هستند؟, در نوکلئیک اسیدهای خطی، در یک انتها گروه فسفات و در انتهای دیگر گروه هیدروکسیل آزاد است.
 چرا هر رشتهٔ دنا و رنای خطی دو سر متفاوت دارند؟, به دلیل وجود گروه فسفات در یک انتها و گروه هیدروکسیل در انتهای دیگر.
 در ابتدا چه تصوری درباره توزیع نوکلئوتید‌ها در مولکول دنا وجود داشت؟, تصور می‌شد که چهار نوع نوکلئوتید به نسبت مساوی در سراسر مولکول دنا توزیع شده‌اند.
 چه مشاهداتی از تحقیقات چارگاف برای نوکلئوتیدهای دنا به دست آمد؟, مقدار آدنین با مقدار تیمین برابر بوده و مقدار گوانین با مقدار سیتوزین برابری می‌کند.
 چرا مقدار آدنین با مقدار تیمین برابر است و مقدار گوانین با مقدار سیتوزین برابری می‌کند؟, تحقیقات نشان داد که این برابری نوکلئوتیدها به دلیل تشکیل جفت پایه‌های هیدروژنی بین آدنین و تیمین، و همچنین بین گوانین و سیتوزین است.
 چگونه ویلکینز و فرانکلین از پرتو ایکس برای تصویربرداری از دنا استفاده کردند؟, ویلکینز و فرانکلین با استفاده از پرتو ایکس تصاویری از مولکول دنا تهیه کردند.
 چه نتایجی از تصاویر تهیه شده با پرتو ایکس برای ساختار دنا به دست آمد؟, از تصاویر تهیه شده نتایجی مانند حالت مارپیچی و وجود بیش از یک رشته در مولکول دنا به دست آمد.
 چرا استفاده از پرتو ایکس برای تصویربرداری از دنا مفید بود؟, این روش به شناخت ساختار دنا و مشخصهای مهم آن کمک کرد، مانند حالت مارپیچی و تعداد رشته‌ها.
 چگونه واتسون و کریک مدل مولکولی نردبان مارپیچ دنا را ارائه دادند؟, با استفاده از نتایج آزمایش‌های چارگاف، داده‌های تصاویر پرتو ایکس و یافته‌های خود، واتسون و کریک مدل مولکولی نردبان مارپیچ دنا را ساختند.
 چرا واتسون و کریک برای ارائه این مدل مولکولی نردبان مارپیچ دنا جایزه نوبل دریافت کردند؟, این مدل مولکولی نردبان مارپیچ دنا که توسط واتسون و کریک ارائه شد، مفهومی بسیار مهم و دقیق از ساختار دنا ارائه داد و تأثیر گذار بر زمینه بیولوژی مولکولی بود، بنابراین آنها در سال ۱۹۶۲ جایزه نوبل دریافت کردند.
 مدل واتسون و کریک چگونه ساختار مولکول دنا را توصیف می‌کند؟, این مدل مولکول دنا را از دو رشته پلی نوکلئوتیدی ساخته‌شده تشکیل داده است که به دور محوری پیچیده می‌شوند و یک ساختار مارپیچ دو رشته‌ای را ایجاد می‌کنند.
 چه نمایی از ساختار مولکول دنا توسط این مدل ارائه می‌شود؟, این مدل نمایی از ساختار مولکول دنا به عنوان دو رشته پلی نوکلئوتیدی که پیچیده شده و به شکل مارپیچ دو رشته‌ای درآمده‌اند، ارائه می‌کند.
 چگونه پیوندهای هیدروژنی دو رشته دنا را به هم متصل می‌کنند؟, پیوندهای هیدروژنی دو رشته را بازه به بازه نگه می‌دارند.
 بازهای مکمل در دنا چه نقشی ایفا می‌کنند؟, بازهای مکمل جفت بازهای مخالف در تشکیل دو رشته را دارند.
 چرا گوانین با تیمین به صورت اختصاصی تشکیل می‌شوند؟, پیوندهای هیدروژنی بازه G با T ایجاد می‌شود.
 چرا آدنین به G و C مکمل می‌شود؟, آدنین به G و C به عنوان بازهای مکمل می‌پیوندد.
 چرا بین C و G پیوند هیدروژنی بیشتری تشکیل می‌شود؟, پیوند هیدروژنی C و G به علت تعداد پیوندهای هیدروژنی بیشتر قوی‌تر است.
 چرا مکمل بودن بازهای آلی نتایج آزمایش چارگاف T و A را تأیید می‌کند؟, آزمایش چارگاف نشان داد T و A جفت بازهای مکمل هستند.
 چگونه قرارگیری جفت بازها در دنا به پایداری مولکول کمک می‌کند؟, قرارگیری جفت بازها باعث ثابت ماندن قطر مولکول شده و پایداری اطلاعات آن را تضمین می‌کند.
 چرا ثابت ماندن قطر دنا مهم است؟, ثابت ماندن قطر دنا باعث پایداری اطلاعات و تأثیر مؤثر در فشرده‌تر شدن فام تن‌ها می‌شود.
 چگونه جفت شدن بازه‌های مکمل در دنا تشکیل ترتیبی یکسان برای نوکلئوتیدها دارد؟, جفت شدن بازه‌های مکمل باعث تشکیل ترتیبی معکوس در رشتهٔ مکمل (ATGC) می‌شود؛ مثلا TACG به ترتیب TGCA.
 چه نتیجه‌ای از ترتیب نوکلئوتیدها در یک رشته می‌توان به ترتیب نوکلئوتیدهای رشتهٔ مکمل انتقال داد؟, ترتیب نوکلئوتیدها در یک رشته ترتیب نوکلئوتیدهای رشتهٔ مکمل را مشخص می‌کند؛ به عنوان مثال TACG معادل TGCA در رشتهٔ مکمل است.
 چگونه پیوندهای هیدروژنی بین نوکلئوتیدها در دنا به پایداری مولکول کمک می‌کنند؟, برقراری پیوندهای هیدروژنی بین نوکلئوتیدها، از هزاران یا میلیون‌ها نوکلئوتید تشکیل شده، پایداری مولکول دنا را افزایش می‌دهد.
 چطور ممکن است دو رشته دنا در موقع نیاز از هم جدا شوند؟, در برخی نقاط، پیوندهای هیدروژنی می‌توانند کمرنگ شده و دو رشته دنا از هم جدا شوند؛ این امر برای انجام وظایف مختلف ضروری است.
 رنا چگونه از دنا متمایز می‌شود و چه وظایفی انجام می‌دهد؟, رنا از بخش‌های رشته دنا ساخته می‌شود و وظایف متعددی از جمله انتقال اطلاعات از دنا به رناتن‌ها و پروتئین‌سازی توسط رنای پیک، نقل آمینواسیدها با رنای ناقل و شرکت در ساختار رناتن‌ها با رنای رناتنی دارد.
 چه نقشی در ساخت پروتئین دارند؟, رنای پیک (mRNA) اطلاعات ژنتیکی از دنا به رناتن‌ها منتقل می‌کند، که توسط آن پروتئین‌ها ساخته می‌شوند.
 چگونه ترجمه پروتئینی در رناها اتفاق می‌افتد؟, ترجمه پروتئینی توسط رنای پیک (mRNA) با همکاری رنای ناقل (tRNA) انجام می‌شود.
 نقش rRNA در رناتن چیست؟, rRNA در ساختار رناتن‌ها شرکت دارد و همچنین در ترجمه پروتئین‌ها نقش دارد.
 ژن چیست و کجا قرار دارد؟, ژن بخشی از مولکول دنا است که می‌تواند به تولید رنا یا پلی‌پپتید منجر شود و در ساختار دنا قرار دارد.
 چه وظایفی دارد و چگونه اطلاعات وراثتی را منتقل می‌کند؟, ژن‌ها اطلاعات وراثتی را ذخیره و به نسل‌های بعدی منتقل می‌کنند.
 چگونه ژن‌ها به تولید رنا یا پلی‌پپتید منجر می‌شوند؟, ژن‌ها با ترجمه به رنا یا با تولید پلی‌پپتید از طریق فرآیندهای بیان ژنی، دستورالعمل‌های دنا را اجرا می‌کنند.
 نقش آدنوزین‌تری فسفات (ATP) در یاخته چیست؟, ATP منبع انرژی رایج در یاخته است و در فعالیت‌های مختلف سلولی استفاده می‌شود.
 چگونه نوکلئوتیدها در نقل الکترون در فرایندهای فتوسنتز و تنفس یاخته‌ای نقش دارند؟, نوکلئوتیدها در مولکول‌هایی وارد می‌شوند که در نقل الکترون در فرایندهای فتوسنتز و تنفس یاخته‌ای نقش ناقل الکترون را بر عهده دارند.
 چگونه اطلاعات وراثتی بدون کاهش به دو یاخته در تقسیم سلولی منتقل می‌شوند؟, این اطلاعات از طریق همانندسازی دنا به دو یاخته منتقل می‌شوند.
 چه نامی به ساختن مولکول دنای جدید از روی دنای قدیمی گفته می‌شود؟, همانندسازی دنا یا Replication.
 چرا مدل واتسون و کریک وجود رابطهٔ مکملی بین بازهای دنا را برای همانندسازی دنا توجیه می‌کند؟, این مدل تا حد زیادی توضیح می‌دهد چرا بازهای دنا مکمل یکدیگر هستند و چگونه اطلاعات به دو یاخته منتقل می‌شود.
 چگونه همانندسازی حفاظتی در دنا توصیف می‌شود؟, در این طرح، دو رشته از دنا به صورت دست‌نخورده حفظ می‌شوند و هر کدام وارد یک یاخته می‌شوند.
 توضیح دهید چگونه در همانندسازی نیمه حفاظتی دنا رخ می‌دهد؟, در این روش، در هر یاخته، یکی از دو رشته دنای اولیه حفظ می‌شود و رشتهٔ دیگر با استفاده از نوکلئوتید‌های جدید ساخته می‌شود.
 توضیح دهید چگونه در همانندسازی غیر حفاظتی (پراکنده) دنا رخ می‌دهد؟, در این روش، در هر دو دنای حاصل از تقسیم، قطعاتی از رشته‌های قبلی (دنای اولیه) و همچنین رشته‌های جدید به صورت پراکنده در خود دارند.
 چگونه مزلسون و استال به تصمیم گیری دربارهٔ همانندسازی دنا پرداختند؟, مزلسون و استال با طراحی آزمایشی و به کارگیری نشانه‌گذاری با نوکلئوتید‌های حاوی ایزوتوپ سنگین نیتروژن (۱۵N)، توانستند رشته‌های دنای جدید (نوساز) را از رشته‌های قدیمی (۱۵N) تشخیص دهند و بررسی کنند کدام رشته در هر یاخته حاصل از تقسیم و می‌تواند به همانندسازی‌های مختلف اشاره داشته باشد.
 چگونه مزلسون و استال از نوکلئوتیدهای حاوی ایزوتوپ سنگین نیتروژن استفاده کردند؟, با استفاده از نوکلئوتیدهای حاوی ایزوتوپ سنگین نیتروژن (۱۵N) در رشته‌های دنا، مزلسون و استال توانستند دناهای نوساز را از دناهای قدیمی تمایز دهند و از طریق تکنیک‌های مانند سانتریفیوژ سرعت بالا آنها را جدا کنند.
 چگونه مزلسون و استال از نوکلئوتیدهای حاوی ایزوتوپ سنگین نیتروژن (۱۵N) در محیط کشت باکتری‌ها استفاده کردند؟, آنها با نشانه گذاری باکتری‌ها با نوکلئوتیدهای حاوی ایزوتوپ سنگین نیتروژن (۱۵N) و اجازه دادن به آنها برای رشد و تکثیر در محیطی حاوی این نوکلئوتیدها، باکتری‌هایی تولید کردند که دنای سنگین‌تری نسبت به باکتری‌های اولیه داشتند.
 چگونه باکتری‌ها به محیط کشت حاوی نوکلئوتیدهای ۱۴N منتقل شدند و بررسی انجام شد؟, باکتری‌ها به محیط کشت حاوی نوکلئوتیدهای ۱۴N منتقل شدند.
 چگونه چگالی دناها در هر فاصلهٔ زمانی اندازه‌گیری شد؟, دنای باکتری‌ها استخراج شد و در محلولی از سزیم کلرید با سرعت بسیار بالا گریز دادند تا چگالی آنها در هر فاصلهٔ زمانی سنجیده شود.
 نتایج آزمایش مزلسون و استال چه نتایجی نشان می‌دهند؟, نتایج آزمایش نشان می‌دهد که همانندسازی دنا در این موارد نیمه حفاظتی است.
 چگونه دو رشته دنا از یکدیگر باز می‌شوند؟, تحقیقات نشان داده که در محلی که همانندسازی انجام می‌شود، دو رشته دنا باز می‌شوند.
 عوامل مهم همانندسازی چیستند؟, عوامل مهم همانندسازی شامل:
 چه مراحلی در همانندسازی دنا وجود دارد؟, مراحل همانندسازی دنا شامل:
 کدام آنزیم در باز کردن مارپیچ دنا در همانندسازی نقش دارد؟, آنزیم هلیکاز ۱ در باز کردن مارپیچ دنا در همانندسازی نقش دارد.
 آنزیم هلیکاز چه پیوندهایی را در باز کردن دو رشته دنا از هم جدا می‌کند؟, آنزیم هلیکاز به وسیلهٔ پیوندهای هیدروژنی میان نوکلئوتیدها، پیوندهای هیدروژنی بین جفت‌شده‌ی آدنین و تیمین را از هم جدا می‌کند.
 آیا آنزیم دنابسپاراز ۲ پلی مراز در همانندسازی دنا نقش دارد؟, آنزیم دنابسپاراز ۲ پلی مراز در جفت کردن نوکلئوتیدهای مکمل با نوکلئوتیدهای رشته الگو در همانندسازی دنا نقش دارد.
 در محلی که دو رشته دنا از هم جدا می‌شوند، دوراهی همانندسازی چگونه اتفاق می‌افتد؟, در دوراهی همانندسازی، دو ساختار به وجود می‌آید که هریک به آنها دوراهی همانندسازی گفته می‌شود.
 دنابسپاراز چه وظایفی در همانندسازی دنا دارد؟, فعالیت بسپارازی و ویرایش نوکلئازی برای مکمل‌سازی و اصلاح نوکلئوتیدها.
 چرا آنزیم دنابسپاراز ویرایش نوکلئوتیدها انجام می‌دهد؟, برای رفع اشتباهات در همانندسازی و جلوگیری از تغییر نادرست نوکلئوتید.
 توانایی بریدن دنا توسط آنزیم دنابسپاراز چه نام دارد؟, فعالیت نوکلئازی یا ویرایش دنابسپاراز.
 مکمل‌سازی دنا در پیش هسته‌ای‌ها چگونه انجام می‌شود؟, در سیتوپلاسم، رشته الگو مکمل نوکلئوتید‌های آماده را به ترتیب پیوند می‌دهد.
 چگونه پیش‌هسته‌ای‌ها از یوکاریوت‌ها در مورد مکمل‌سازی دنا متفاوتند؟, در پیش‌هسته‌ای‌ها دنا در سیتوپلاسم حلقوی و بدون هسته قرار دارد.
 چگونه دنا در یوکاریوت‌ها سازمان‌دهی شده است؟, دنای هسته‌ای در فام تن خطی و با هیستون‌ها درون هسته قرار دارد.
 دنای سیتوپلاسمی در کجا وجود دارد؟, دنای سیتوپلاسمی در راکیزه و سبزدیسه یافت می‌شود.
